{
  "domain_id": "service_business",
  "name": "Service Business",
  "version": "1.0.0",
  "status": "new",
  "description": "Shared receptionist behavior for field/service businesses.",
  "naics_codes": [
    "238220",
    "561790"
  ],
  "intent_catalog": [
    "service_capability",
    "service_area_question",
    "estimate_request",
    "booking_request",
    "after_hours_question"
  ],
  "entity_catalog": [
    "offering",
    "location",
    "service_area",
    "urgency",
    "customer_status"
  ],
  "page_type_weights": {
    "service_detail": 1.5,
    "service_area": 1.3,
    "faq": 1.2,
    "blog_article": 0.4
  },
  "content_class_biases": {
    "operational_core": 1.4,
    "policy_boundary": 1.5,
    "educational": 0.3
  },
  "ranking_rules": [
    "prefer service-detail pages for capability questions",
    "prefer service-area pages for city questions"
  ],
  "boundary_rules": [
    "do not invent emergency availability",
    "do not invent pricing"
  ],
  "clarification_rules": [
    "ask for city only when needed",
    "ask for service type only when needed"
  ],
  "default_stage_guidance": {
    "advance_next_step": "prefer estimate booking, callback, or message-taking"
  },
  "default_prompt_fragments": [
    "You are a receptionist / soft-sales assistant for a service business."
  ],
  "required_eval_suites": [
    "service_business_core",
    "dangerous_questions_basic"
  ],
  "created_at": "2026-03-14T00:00:00Z",
  "updated_at": "2026-03-14T00:00:00Z"
}
